Name,MaxDepDelay
"Frontier Airlines Inc.: F9",737
"Southwest Airlines Co.: WN",804
"PSA Airlines Inc.: OH",888
"Allegiant Air: G4",972
"Spirit Air Lines: NK",1007
"JetBlue Airways: B6",1069
"Alaska Airlines Inc.: AS",1117
"Hawaiian Airlines Inc.: HA",1142
"Delta Air Lines Inc.: DL",1242
"Mesa Airlines Inc.: YV",1248
"United Air Lines Inc.: UA",1250
"Endeavor Air Inc.: 9E",1317
"Republic Airline: YX",1355
"ExpressJet Airlines LLC: EV",1412
"SkyWest Airlines Inc.: OO",1424
"American Airlines Inc.: AA",1663
"Envoy Air: MQ",2079
